mysql> select*from faculty;
+-------+---------+--------+------------+------------+------------+------------+------------+
| facno | facname | gender | DOB        | DOJ        | mobileno   | status     | department |
+-------+---------+--------+------------+------------+------------+------------+------------+
| 2     | mega    | F      | 2000-09-12 | 2022-01-30 | 9425685421 | working    | CSE        |
| 1     | shankar | M      | 1976-12-04 | 2001-04-21 | 9424685421 | notworking | CSE        |
| 3     | shekar  | M      | 1977-10-14 | 2005-08-11 | 9824685421 | working    | AIDS       |
| 4     | ram     | M      | 1983-05-01 | 2002-05-21 | 9424785421 | notworking | EEE        |
| 6     | sheela  | F      | 1986-07-16 | 2004-06-24 | 9429685425 | working    | AIDS       |
| 7     | kamal   | M      | 1985-12-14 | 2010-05-03 | 9868482936 | working    | ECE        |
| 13    | raju    | M      | 2000-10-23 | 2022-04-29 | 9444124421 | notworking | MECH       |
+-------+---------+--------+------------+------------+------------+------------+------------+
7 rows in set (0.00 sec)

mysql> commit;
Query OK, 0 rows affected (0.00 sec)

mysql> delete from faculty where facno=13;
Query OK, 1 row affected (0.01 sec)

mysql> select *from faculty;
+-------+---------+--------+------------+------------+------------+------------+------------+
| facno | facname | gender | DOB        | DOJ        | mobileno   | status     | department |
+-------+---------+--------+------------+------------+------------+------------+------------+
| 2     | mega    | F      | 2000-09-12 | 2022-01-30 | 9425685421 | working    | CSE        |
| 1     | shankar | M      | 1976-12-04 | 2001-04-21 | 9424685421 | notworking | CSE        |
| 3     | shekar  | M      | 1977-10-14 | 2005-08-11 | 9824685421 | working    | AIDS       |
| 4     | ram     | M      | 1983-05-01 | 2002-05-21 | 9424785421 | notworking | EEE        |
| 6     | sheela  | F      | 1986-07-16 | 2004-06-24 | 9429685425 | working    | AIDS       |
| 7     | kamal   | M      | 1985-12-14 | 2010-05-03 | 9868482936 | working    | ECE        |
+-------+---------+--------+------------+------------+------------+------------+------------+
6 rows in set (0.00 sec)

mysql> rollback;
Query OK, 0 rows affected (0.00 sec)

mysql> select*from faculty;
+-------+---------+--------+------------+------------+------------+------------+------------+
| facno | facname | gender | DOB        | DOJ        | mobileno   | status     | department |
+-------+---------+--------+------------+------------+------------+------------+------------+
| 2     | mega    | F      | 2000-09-12 | 2022-01-30 | 9425685421 | working    | CSE        |
| 1     | shankar | M      | 1976-12-04 | 2001-04-21 | 9424685421 | notworking | CSE        |
| 3     | shekar  | M      | 1977-10-14 | 2005-08-11 | 9824685421 | working    | AIDS       |
| 4     | ram     | M      | 1983-05-01 | 2002-05-21 | 9424785421 | notworking | EEE        |
| 6     | sheela  | F      | 1986-07-16 | 2004-06-24 | 9429685425 | working    | AIDS       |
| 7     | kamal   | M      | 1985-12-14 | 2010-05-03 | 9868482936 | working    | ECE        |
| 13    | raju    | M      | 2000-10-23 | 2022-04-29 | 9444124421 | notworking | MECH       |
+-------+---------+--------+------------+------------+------------+------------+------------+
7 rows in set (0.00 sec)